{
  "claim_id": "auto_m004",
  "claim_type": "auto",
  "policy_id": "POL-337788",
  "claimant_name": "Tyler Brooks",
  "incident_date": "2026-04-02",
  "date_reported": "2026-04-03",
  "incident_description": "Backed into a mailbox, cracked rear bumper. No firm repair estimate given, only a rough range.",
  "line_items": null,
  "claimed_amount_stated": null,
  "claimed_amount_computed": null,
  "supporting_documents": {
    "police_report": false,
    "photos": false,
    "receipts": false
  },
  "resolution_expectation": "clarify",
  "known_issues": [
    "missing_field"
  ]
}