{
  "claim_id": "prop_c002",
  "claim_type": "property",
  "policy_id": "POL-556123",
  "claimant_name": "Nadia Farouk",
  "incident_date": "2026-03-02",
  "date_reported": "2026-03-03",
  "incident_description": "Burst supply pipe caused water damage to bathroom floor and ceiling below.",
  "line_items": [
    {
      "description": "Water extraction and drying",
      "amount": 850.0
    },
    {
      "description": "Bathroom subfloor repair",
      "amount": 1100.0
    },
    {
      "description": "Ceiling repair (room below)",
      "amount": 640.0
    }
  ],
  "claimed_amount_stated": 2590.0,
  "claimed_amount_computed": 2590.0,
  "supporting_documents": {
    "police_report": false,
    "photos": true,
    "receipts": false
  },
  "resolution_expectation": "route_specialist",
  "known_issues": [
    "none"
  ]
}