{
  "claim_id": "auto_m001",
  "claim_type": "auto",
  "policy_id": null,
  "claimant_name": "R. Okafor",
  "incident_date": "2026-08-10",
  "date_reported": null,
  "incident_description": "Scraped the car against a parking pole backing out, minor damage to rear bumper. No repair quote obtained yet.",
  "line_items": null,
  "claimed_amount_stated": null,
  "claimed_amount_computed": null,
  "supporting_documents": {
    "police_report": false,
    "photos": false,
    "receipts": false
  },
  "resolution_expectation": "clarify",
  "known_issues": [
    "missing_field"
  ]
}